{
  "name": "better-auth",
  "description": "Skill for integrating Better Auth - comprehensive TypeScript authentication framework for Cloudflare D1, Next.js, Nuxt, and 15+ frameworks. Use when adding auth, encountering D1 adapter errors, or implementing OAuth/2FA/RBAC features.",
  "version": "3.10.0",
  "author": {
    "name": "Claude Skills Maintainers",
    "email": "maintainers@example.com"
  },
  "license": "MIT",
  "repository": "https://github.com/secondsky/claude-skills",
  "keywords": [
    "better-auth",
    "better",
    "auth",
    "authentication",
    "authorization",
    "login",
    "security",
    "session",
    "rbac"
  ],
  "agents": [
    "./agents/better-auth-debugger.md"
  ],
  "commands": [
    "./commands/better-auth-add-plugin.md",
    "./commands/better-auth-setup.md",
    "./commands/explain-error.md",
    "./commands/providers.md"
  ]
}
