{
  "name": "multi-ai-consultant",
  "description": "Consult external AIs (Gemini 2.5 Pro, OpenAI Codex, Claude) for second opinions. Use for debugging failures, architectural decisions, security validation, or need fresh perspective with synthesis.",
  "version": "3.11.0",
  "author": {
    "name": "Claude Skills Maintainers",
    "email": "maintainers@example.com"
  },
  "license": "MIT",
  "repository": "https://github.com/secondsky/claude-skills",
  "keywords": [
    "multi-ai-consultant",
    "multi",
    "consultant",
    "machine-learning",
    "llm",
    "artificial-intelligence",
    "openai",
    "validation"
  ],
  "commands": [
    "./commands/consult-ai.md",
    "./commands/consult-claude.md",
    "./commands/consult-codex.md",
    "./commands/consult-gemini.md"
  ]
}
