{
  "name": "project-workflow",
  "description": "Project lifecycle automation with 7 slash commands: /explore-idea, /plan-project, /plan-feature, /continue-session, /wrap-session, /release, /workflow. Use for idea exploration, project planning, session management, and safe releases.",
  "version": "3.0.0",
  "author": {
    "name": "Claude Skills Maintainers",
    "email": "maintainers@example.com"
  },
  "license": "MIT",
  "repository": "https://github.com/secondsky/claude-skills",
  "keywords": [
    "project-workflow",
    "project",
    "workflow",
    "project workflow",
    "lifecycle automation",
    "slash commands",
    "planning",
    "session management",
    "release safety",
    "implementation phases",
    "implementation"
  ],
  "commands": [
    "./commands/continue-session.md",
    "./commands/explore-idea.md",
    "./commands/plan-feature.md",
    "./commands/plan-project.md",
    "./commands/release.md",
    "./commands/workflow.md",
    "./commands/wrap-session.md"
  ]
}
