{
  "name": "delegate-my-work",
  "description": "Interview employees to find recurring work, map accessible AI and automation tools, and spec each loop with preferred and fallback routes.",
  "version": "3.11.0",
  "author": {
    "name": "Claude Skills Maintainers",
    "email": "maintainers@example.com"
  },
  "license": "MIT",
  "repository": "https://github.com/secondsky/claude-skills",
  "keywords": [
    "delegate-my-work",
    "delegate",
    "work",
    "tooling",
    "workflow"
  ],
  "commands": [
    "./commands/delegate.md"
  ]
}
